{
  "id": "example1",
  "title": "Das geöffnete Fenster",
  "language": "Indonesian",
  "original_text": "Jendela yang Terbuka\n\nDi sebuah desa, ada rumah tua dengan jendela besar yang selalu terbuka. Warga desa sering bertanya-tanya siapa yang membuka jendela itu setiap pagi. Suatu hari, Ardi, seorang pemuda yang baru pindah, memutuskan untuk menyelidikinya.\n\nIa memasuki rumah dan menemukan sebuah buku tua di meja. Di halaman terakhir, ada gambar seorang wanita duduk di depan jendela. Tiba-tiba, Ardi mendengar suara lembut memanggil namanya.\n\n\"Ardi...\"\n\nIa menoleh dan melihat bayangan wanita berpakaian putih, duduk di depan jendela, tersenyum padanya. Sebelum Ardi bisa berbicara, wanita itu menghilang. Sejak saat itu, Ardi selalu membuka jendela setiap pagi, berharap bisa menemukan jawabannya.",
  "dictionary": {
    "Jendela": "Fenster",
    "yang": "die/der/das",
    "Terbuka": "offen",
    "Di": "in",
    "sebuah": "ein",
    "desa": "Dorf",
    "ada": "es gibt",
    "rumah": "Haus",
    "tua": "alt",
    "dengan": "mit",
    "jendela": "Fenster",
    "besar": "groß",
    "selalu": "immer",
    "terbuka": "offen",
    "Warga": "Bewohner",
    "sering": "oft",
    "bertanya-tanya": "sich fragen",
    "siapa": "wer",
    "membuka": "öffnen",
    "itu": "das",
    "setiap": "jeden",
    "pagi": "Morgen",
    "Suatu": "eines",
    "hari": "Tages",
    "Ardi": "Ardi",
    "seorang": "eine/ein",
    "pemuda": "junger Mann",
    "baru": "neu",
    "pindah": "umgezogen",
    "memutuskan": "entschließen",
    "untuk": "um/zu",
    "menyelidikinya": "es untersuchen",
    "Ia": "Er",
    "memasuki": "betreten",
    "dan": "und",
    "menemukan": "finden",
    "sebuah": "ein",
    "buku": "Buch",
    "di": "auf/in",
    "meja": "Tisch",
    "halaman": "Seite",
    "terakhir": "letzte",
    "ada": "es gibt",
    "gambar": "Bild",
    "seorang": "eine",
    "wanita": "Frau",
    "duduk": "sitzen",
    "depan": "vorne",
    "Tiba-tiba": "plötzlich",
    "mendengar": "hören",
    "suara": "Stimme",
    "lembut": "sanft",
    "memanggil": "rufen",
    "namanya": "seinen Namen",
    "menoleh": "sich umdrehen",
    "melihat": "sehen",
    "bayangan": "Schatten",
    "berpakaian": "gekleidet",
    "putih": "weiß",
    "tersenyum": "lächeln",
    "padanya": "ihn an",
    "Sebelum": "bevor",
    "bisa": "kann",
    "berbicara": "sprechen",
    "itu": "sie/das",
    "menghilang": "verschwinden",
    "Sejak": "seit",
    "saat": "Moment",
    "selalu": "immer",
    "membuka": "öffnen",
    "berharap": "hoffen",
    "bisa": "können",
    "menemukan": "finden",
    "jawabannya": "die Antwort"
  },
  "full_translation": "Das geöffnete Fenster\n\nIn einem Dorf stand ein altes Haus mit einem großen Fenster, das immer offen war. Die Dorfbewohner fragten sich oft, wer das Fenster jeden Morgen öffnete. Eines Tages beschloss Ardi, ein junger Mann, der gerade umgezogen war, der Sache nachzugehen.\n\nEr betrat das Haus und fand auf dem Tisch ein altes Buch. Auf der letzten Seite war ein Bild einer Frau, die vor dem Fenster saß. Plötzlich hörte Ardi eine sanfte Stimme, die seinen Namen rief.\n\n\"Ardi...\"\n\nEr drehte sich um und sah den Schatten einer weiß gekleideten Frau, die vor dem Fenster saß und ihn anlächelte. Bevor Ardi sprechen konnte, verschwand die Frau. Seit diesem Moment öffnete Ardi jeden Morgen das Fenster, in der Hoffnung, die Antwort zu finden."
}
