{
  "id": "example2",
  "title": "Ein Tag im Park",
  "language": "es",
  "original_text": "Un día en el parque\n\nEra un día soleado y Carlos decidió ir al parque. Caminó por el sendero mientras escuchaba el canto de los pájaros. Se sentó en una banca cerca de un árbol grande. Miró a su alrededor y vio a niños jugando, a personas leyendo libros y a una familia haciendo un picnic.\n\nCarlos sacó su libro favorito y comenzó a leer, pero pronto se dio cuenta de que lo rodeaba la calma y la belleza del parque. Cerró el libro y cerró los ojos por un momento, disfrutando del aire fresco.\n\nEl día pasó rápido y Carlos se sintió feliz de haber disfrutado de un momento tranquilo en la naturaleza.",
  "dictionary": {
    "Un": "Ein",
    "día": "Tag",
    "en": "im",
    "el": "der",
    "parque": "Park",
    "Era": "Es war",
    "soleado": "sonnig",
    "y": "und",
    "Carlos": "Carlos",
    "decidió": "entschied",
    "ir": "gehen",
    "al": "zum",
    "Caminó": "Er ging",
    "por": "auf",
    "el": "dem",
    "sendero": "Weg",
    "mientras": "während",
    "escuchaba": "hörte",
    "el": "das",
    "canto": "Gesang",
    "de": "der",
    "los": "die",
    "pájaros": "Vögel",
    "Se": "Er",
    "sentó": "setzte sich",
    "en": "auf",
    "una": "eine",
    "banca": "Bank",
    "cerca": "nahe",
    "de": "von",
    "un": "ein",
    "árbol": "Baum",
    "grande": "groß",
    "Miró": "Er schaute",
    "a": "um",
    "su": "sein",
    "alrededor": "herum",
    "y": "und",
    "vio": "sah",
    "niños": "Kinder",
    "jugando": "spielen",
    "personas": "Menschen",
    "leyendo": "lesend",
    "libros": "Bücher",
    "y": "und",
    "una": "eine",
    "familia": "Familie",
    "haciendo": "machend",
    "un": "ein",
    "picnic": "Picknick",
    "sacó": "holte heraus",
    "su": "sein",
    "libro": "Buch",
    "favorito": "Lieblings",
    "comenzó": "begann",
    "leer": "lesen",
    "pero": "aber",
    "pronto": "bald",
    "se": "er",
    "dio": "merkte",
    "cuenta": "es",
    "de": "dass",
    "que": "es",
    "lo": "ihn",
    "rodeaba": "umgab",
    "la": "die",
    "calma": "Ruhe",
    "y": "und",
    "la": "die",
    "belleza": "Schönheit",
    "cerró": "schloss",
    "los": "die",
    "ojos": "Augen",
    "por": "für",
    "un": "einen",
    "momento": "Moment",
    "disfrutando": "genießend",
    "del": "von der",
    "aire": "Luft",
    "fresco": "frisch",
    "El": "Der",
    "día": "Tag",
    "pasó": "verging",
    "rápido": "schnell",
    "se": "er",
    "sintió": "fühlte sich",
    "feliz": "glücklich",
    "de": "dass",
    "haber": "erlebt",
    "disfrutado": "genossen",
    "un": "einen",
    "momento": "Moment",
    "tranquilo": "ruhig",
    "en": "in",
    "la": "der",
    "naturaleza": "Natur"
  },
  "full_translation": "Ein sonniger Tag und Carlos entschied, zum Park zu gehen. Er ging den Weg entlang, während er den Gesang der Vögel hörte. Er setzte sich auf eine Bank nahe einem großen Baum. Er schaute sich um und sah Kinder spielen, Menschen lesen Bücher und eine Familie, die ein Picknick machte.\n\nCarlos holte sein Lieblingsbuch heraus und begann zu lesen, aber bald merkte er, dass ihn die Ruhe und Schönheit des Parks umgaben. Er schloss das Buch und schloss für einen Moment die Augen, um die frische Luft zu genießen.\n\nDer Tag verging schnell und Carlos fühlte sich glücklich, einen ruhigen Moment in der Natur genossen zu haben."
}
